[
  {
    "boundary_version_id": "ward-example-2024",
    "area_type": "ward",
    "area_code": "E05000000",
    "area_name": "Example Ward",
    "valid_from": "2024-04-01",
    "valid_to": null,
    "predecessor_boundary_version_ids": [],
    "successor_boundary_version_ids": [],
    "source_snapshot_id": "example-boundary-source-2026-04-18",
    "source_url": "https://geoportal.statistics.gov.uk/",
    "review_status": "quarantined"
  }
]
